id,sentence,genre
triH6ECZmBM_seg_00005,মনটাকে হারাবো যে ওই বাঁকে কাছে এসে,Pop
triH6ECZmBM_seg_00006,ধীরে ধীরে কোনখানে ভেসে যাই চলে যাই গোপনে জানে না মন জানে না তুই চোখে চোখ রেখেছে থাকি পলকে কোন,Pop
triH6ECZmBM_seg_00007,আলে তুমি বোঝো না তোমারি কাছে যেন আমারই মন বাঁধা আছে তোমাকে ছুয়ে যেন সারাক্ষণ এই মন বাঁচে কাছে আসো,Pop
triH6ECZmBM_seg_00008,কোন বাতাস হারাবো তোমার আদরে খুব কাছাকাছি যেন আমি আছি তোমারই তো প্রেমে,Pop
triH6ECZmBM_seg_00009,দিবানিশি ভাসি ছুয়ে দিয়ে তোমার মনেরই সীমানা বারে বারে ফিরে,Pop
triH6ECZmBM_seg_00010,আসি যদি তুমি নদী হয়ে যাও ঢেউ হয়ে আমাকে ভাসা ভালোবেসে,Pop
TWHLqVajlOk_seg_00001,ভুলের স্রোতে ভুলে যাওয়া স্বপ্নে তোমায় ফিরে পাওয়া ঘুম ভুল ভরে তোমারি হতে চাওয়া মনে গভীরে রেখে,Indie/Folk-Pop
TWHLqVajlOk_seg_00002,দেয়া স্বপ্নে তোমায় একে যাওয়া ফেলে আসা বন্ধুতে তোমাকে খুঁজে ফেরা চলো আজ ফিরে,Indie/Folk-Pop
TWHLqVajlOk_seg_00003,যাই গোধুলির ওপারে চলো আজ ফিরে যাই,Indie/Folk-Pop
TWHLqVajlOk_seg_00004,আশা আকাশটা কে হয়নি ধরা ফুলের স্রোতে হয়নি ছোঁয়া ওই আলোর স্বপ্ন চুরা সূর্য ঢাকা ভোরের পথে হারিয়ে যাও,Indie/Folk-Pop
TWHLqVajlOk_seg_00005,স্মৃতির সাথে তোমাকে ফিরে পেতে আমার অপেক্ষা চলো,Indie/Folk-Pop
TWHLqVajlOk_seg_00006,আজ ফিরে যা মধুলির চলো আজ ফিরে,Indie/Folk-Pop
TWHLqVajlOk_seg_00007,যাই মধুলির গোপালে শক্তহীন বালু জ্বলে ফিরে এসে আমার চলে,Indie/Folk-Pop
TWHLqVajlOk_seg_00008,রাঙিয়ে যাও আজ তোমার রঙে রং মশালে সেই আলোতে বলতে চাই আজ,Indie/Folk-Pop
TWHLqVajlOk_seg_00009,তোমাকে না বলো অনুভূতি ভাষায় ফেলে চলো আজ ফিরে,Indie/Folk-Pop
TWHLqVajlOk_seg_00010,যাই গোধুলি ওপারে চলো আজ ফিরে যাই,Indie/Folk-Pop
U2MFX3h8JVI_seg_00001,জানিনা কেন যে আজ মন হারালো দূর আকাশে জানিনা কেন যে আজ মন হারালো দূর আকাশে মেঘেরও পাশে নীলে ভেসে ভেসে স্মৃতির,Pop
U2MFX3h8JVI_seg_00002,আবেশে হেসে হেসে জানিনা কেন যে আজ মন হারালো দূর আকাশে জানিনা কেন যে আজ মন হারালো দূর আকাশে মেঘেরও পাশে নীলে ভেসে ভেসে স্মৃতির,Pop
U2MFX3h8JVI_seg_00003,আবেশে হেসে হেসে জানিনা কেন যে আজ মন হারালো দূর আকাশে জানিনা কেন যে আজ মন হারালো দূর,Pop
U2MFX3h8JVI_seg_00004,চঞ্চল মন হায় উড়িয়া যেতে চায় সবুজ বনে বাজারে করিয়া কানাকানি বিষয় না জানি নিষিদ্ধ অসীম আধারে চঞ্চল মন হায় উড়িয়া যেতে চায় সবুজ মনে,Pop
U2MFX3h8JVI_seg_00005,বাঁধারে করিয়া কানাকানি বিষয়ও না জানি নিষিধ অসীম আধারে মেঘের ওপাশে নীলে ভেসে ভেসে স্মৃতির আবেশে হেসে হেসে জানিনা কেন যে আজ মন হারালো দূর,Pop
U2MFX3h8JVI_seg_00006,আকাশে জানিনা কেন যে আজ মন হারালো দূর,Pop
U2MFX3h8JVI_seg_00007,সঞ্জল মন যায় স্বপ্নে মৃদু পায় হারাতে দূরে পাহাড়ে সঙ্গী হতে চায় মরিয়া মোহনায় মিশিতে গহীন সাগরে চঞ্চালো মন যায় স্বপ্নে মৃদু পায় হাতে দূরের,Pop
U2MFX3h8JVI_seg_00008,পাহাড়া সঙ্গী চাঁদ পড়িয়া মোহনায় মিশিতে গহীন সাগরে মেঘের ওপাশে নীলে ভেসে ভেসে স্মৃতির আবেশে হেসে হেসে জানিনা কেন যে আজ মন হারালো দূর,Pop
U2MFX3h8JVI_seg_00009,আকাশে জানিনা কেন যে আজ মন হারালো দূর আকাশে মেঘের পাশে নীলে ভেসে ভেসে স্মৃতির আবেশে ভেসে হেসে,Pop
VcZ2MAQlJZA_seg_00001,রাতেরও গভীরে চর দেয় যে আলো তোমার ভালোবাসা লাগে তো ভালো দিক দিশা হয়ে তুমি কার পানে ছোট,Pop
VcZ2MAQlJZA_seg_00002,অন্ধকারে ছিলা আমি তোমারি আলো দিলো না দিলা না তুমি তো দিলা না কথা ফুল ঝরে গেল তুমি তো দিলা,Pop
VcZ2MAQlJZA_seg_00003,না দিলা না দিলা না তুমি তো দিলা না কথা,Pop
VcZ2MAQlJZA_seg_00004,সুখেরও বাগানে ছিলাম ফুটন্ত গলা কত নান অভিমান,Pop
VcZ2MAQlJZA_seg_00005,কত নলা ও সুখেরও বাগানে ছিল গলা,Pop
VcZ2MAQlJZA_seg_00006,কত নামান অভিমান কত নলা এস একজনে জলে কি পেয়েছো তুমি,Pop
VcZ2MAQlJZA_seg_00007,নিজেকে হারিয়ে দিল না দিলা না তুমি তো দিলা না কত ফুল ঝরে তো দিলা,Pop
VcZ2MAQlJZA_seg_00008,দিলা না দিলা না তুমি দিল না কত সর,Pop
VcZ2MAQlJZA_seg_00009,কত না স্বপ্ন ছিল দুচোখে অশার হাত ধরে হেটেছি,Pop
VcZ2MAQlJZA_seg_00010,দুজন জন্যে কত নম্ব ছিল এ দুচোখে,Pop
VcZ2MAQlJZA_seg_00011,অসর হাত ধরে হেটেছি দুজনে মনের মন্দিরে আপন জেনে সুখে,Pop
VcZ2MAQlJZA_seg_00012,কত পাইবে না দিলা না দিলা না তুমি তো দিলা দিলা তখন জরে তো দিলা দিলা দিল না দিলা,Pop
VcZ2MAQlJZA_seg_00013,তুমি তো দিলা স ও,Pop
XJlXHoh0C4M_seg_00001,চায় কাছে তোকে দিশে হারা মন যেন তোর আদরে ভেজে যায় সারাক্ষণ মন শুধু আজ খুজে অকারণ বলে সব কারণ,Pop
XJlXHoh0C4M_seg_00002,কোন নামহীন দেশে যায় আজ তোকে নিয়ে ভেসে সে অজানা বেশে যাই তোকে ভালোবেসে শুধু তুই আমি মিলে ভাসি ওই তোর মিলে,Pop
XJlXHoh0C4M_seg_00003,চোখে দু চোখ রেখে যাই শুকন একে চায় কাছে তোকে দিশে হারা মন যেন তোর দূরে ভিজে যায় সারাক্ষণ,Pop
XJlXHoh0C4M_seg_00004,আমিও চাই তোর মনে হারাতে তোকে নিয়ে পথ পা বাড়াতে তোকেই ভেবে রোজ করি যে তোর খোজ তোকে নিয়ে মন হয় মন হারা,Pop
XJlXHoh0C4M_seg_00005,ও আমিও চাই তোর মনে হারাতে তোকে নিয়ে পথ পা বাড়াতে তোকেই ভেবে রোজ করি যে তোর খোজ তোকে নিয়ে মনে হয় মন হারা,Pop
XJlXHoh0C4M_seg_00006,তোর কাজে তোর খোজে দিনে রাতে তোর মনে মন রেখে বাসবো আমি তোরই সাথে কোন নামহীন এসে যায় আজ তোকে নিয়ে ভেসে,Pop
XJlXHoh0C4M_seg_00007,সে অজানা বেশে যায় তোকে ভালোবেসে শুধু তুই আমি মিলে যায় হাসি ওই তোর মিলে চোখে দু চোখ রেখে যাই স্বপ্ন এতে,Pop
XJlXHoh0C4M_seg_00008,চায় কাছে তোকে দিশে হারা মন যেন তোর আদরে ভিজে যায় সারা এখন মন শুধু আজ ভরে অকারণ বলে সব এক কারণ,Pop
yGSDD7hiRgU_seg_00001,হা তোমার জন্য ভুল করিয়ে নিলে সাথে খানিক,Pop
yGSDD7hiRgU_seg_00002,ভুল করিয়ে নিলে কাজল চোখে তাকিয়ে যদি হাসি তোমায় ভেবে সন্ধ্যা নামে চ্যুতি চোখের,Pop
yGSDD7hiRgU_seg_00003,কোলে কান্না জমায় নদী সব অভিমান ভুলে ফিরে আসি আমায় ছেড়ে কোথায় যাবে তুমি,Pop
yGSDD7hiRgU_seg_00004,বলবে কে আর এমন করে ভালোবাসি আমায় দিও একটুখানি ছুয়ে আমায় দিও,Pop
yGSDD7hiRgU_seg_00005,একটুখানি মন এই জনমের জন্ম মৃত্যু জানি তুমি ছাড়া শূন্য এ জীবন,Pop
yGSDD7hiRgU_seg_00006,আমায় দিও একটুখানি ছুবে আমায় দিও একটুখানি মন এই জনমের জন্ম মৃত্যু জানে তুমি ছাড়া শূন্য,Pop
yGSDD7hiRgU_seg_00007,তোমায় ছেড়ে গেলে এমন আকাশ পাবো আর কোথায় তোমার কাছে এসে সবটুকু ভালোবেসে যাবো কোথায়,Pop
yGSDD7hiRgU_seg_00008,তোমার জন্য তাকিয়ে য়ে যদি থাকি বুকের ভেতর আসতো আকাশ আকি দুঃখ ভুলে স্বপ্ন সুখে ভাসি,Pop
yGSDD7hiRgU_seg_00009,আমায় ছেড়ে কোথায় যাবে তুমি বলবে কে আর এমন করে ভালোবাসি,Pop
yGSDD7hiRgU_seg_00010,আমায় দিও একটুখানি ছুয়ে আমায় দিও একটুখানি মন এই জনমের জন্ম মৃত্যু জানে তুমি ছাড়া শূন্য এ জীবন,Pop
_z1EfMNUqFs_seg_00001,গুনে গুনে দেখি অবেলার স্বপ্নটাই আঁকা ছিল কত শত কবিতায় স্বপ্নের সেই কবিতার ছন্দতে মিশেছে ছিল তার হাসি মাখা ছবিটা যা আঁকা ছিল অদ্ভুত রংগুলি যা জমা থাকে আমার মন মাঝে বড় হয়ে আমি চড়ছি ঘোড়ায় আড়ালে তুমি,Pop
_z1EfMNUqFs_seg_00002,লুকে আছো বউ সাজে আমার এই স্বপ্ন কি শুধু স্বপ্ন হয়ে হাসাবে আমায় তেমন সাহস নেই আমার তোমাকে কিভাবে প্রস্তাব জানাই আমার এই স্বপ্ন কি শুধু স্বপ্ন হয়ে হাসাবে আমায়,Pop
_z1EfMNUqFs_seg_00003,ഓ কল্পনায় আঁকা আল্পনায় তোমায় নিয়ে ভাবা শত জল্পনায় তুমি আছো বলে বেঁচে আছে স্বপ্নটা তোমায় নিয়ে লেখা এই কবিতা সেই কবিতার ছন্দটা তুমি মিশে থাকা প্রতি অক্ষরে আমি জানালে কি হতে পারে শেষটা,Pop
_z1EfMNUqFs_seg_00004,আমার এই স্বপ্ন কি শুধু স্বপ্ন হয়ে হাসাবে আমায় তেমন সাহস নেই আমার আমার এই স্বপ্ন কি শুধু স্বপ্ন হয়ে,Pop
_z1EfMNUqFs_seg_00005,হাসাবে আমায় তেমন সাহস নেই আমার আমার এই স্বপ্ন কি শুধু স্বপ্ন হয়ে হাসাবে আমায় তেমন সাহস নেই আমার তোমাকে কিভাবে প্রস্তাব জানাই আমার এই স্বপ্ন কি,Pop
_z1EfMNUqFs_seg_00006,শুধু স্বপ্ন হয়ে হাসাবে আমার,Pop
Z4HpPn56LaQ_seg_00001,তোর জন্যে আকাশ পাতাল একটু হলেও হচ্ছি মাতাল কানের খাতায় জায়গা কোথায় কবিতা তোর চোখের,Indie/Folk-Pop
Z4HpPn56LaQ_seg_00002,পাতায় জানতে চাবি কোথায় কেমন কোন দুপুরে পড়ছি কখন কোন রাতে আমি না ঘুমিয়ে কোন সকালে ঘর নিগিয়ে কোন দেশেতে যাই হারিয়ে,Indie/Folk-Pop
Z4HpPn56LaQ_seg_00003,তেপান্তরের মাঠ পেরিয়ে ছোট্ট বাজার হাট পেরিয়ে সুখের খোঁজে ভুল করে সেই তোর,Indie/Folk-Pop
Z4HpPn56LaQ_seg_00004,শহরে তোরই শহরে না,Indie/Folk-Pop
Z4HpPn56LaQ_seg_00005,না অন্ধকারে হাতরে বেড়ায় মনের ভেতর চলছে লড়াই কি খুঁজতে কি খুঁজে পাই দেখলে আলো থমকে,Indie/Folk-Pop
Z4HpPn56LaQ_seg_00006,দাঁড়ায় অদ্ভুত সব মানুষগুলো কিসের খোঁজে ছুটছে বলো কি আসে যায় না পেলে তার কি হবে আজ মন ভেঙে গেলে কোন দেশেতে যায় হারিয়ে তেপান্তরের,Indie/Folk-Pop
Z4HpPn56LaQ_seg_00007,মাঠ পেরিয়ে ছোট্ট বাজার হাট পেরিয়ে,Indie/Folk-Pop
Z4HpPn56LaQ_seg_00008,পথ ভুলে গেছি অচেনা এই ইট পাথরের শহরে মিশে আছে কত শত গল্প অলিগলি আর কত দেয়ালে বন্ধ ঘরে স্বপ্ন ফাটল ধরে পুরো কোন আয় নাই,Indie/Folk-Pop
Z4HpPn56LaQ_seg_00009,যদি সত্যি মেলে মুক্তি আমি ফিরবো না কখনো কোন দেশেতে যায় হারিয়ে তেপান্তরের মাঠ পেরিয়ে ছোট্ট বাজার হাট পেরিয়ে সুখের খোঁজে ভুল করে,Indie/Folk-Pop
